{
  "$schema": "https://crossforge.dev/schemas/release-binding.schema.json",
  "components": [
    {
      "canonical_sha256": "da3f0a6e652dcf58f9ce8d9555e6768a58ced8541714b9807eed07bd8d80e1f2",
      "component": "abi/aarch64-baseline",
      "path": "config/generated/components/abi/aarch64-baseline.json",
      "scope": "qualification"
    },
    {
      "canonical_sha256": "b2fdf9b5876da30249a4431fb9dcb54a4d509d38ebf82882b6df3fa1a4116b42",
      "component": "abi/python-providers",
      "path": "config/generated/components/abi/python-providers.json",
      "scope": "qualification"
    },
    {
      "canonical_sha256": "aba3e03137d08c97d9db5e1723b109657e3b87b9164c99f2ed5d90edaaef6878",
      "component": "abi/x86_64-baseline",
      "path": "config/generated/components/abi/x86_64-baseline.json",
      "scope": "qualification"
    },
    {
      "canonical_sha256": "fdd2704a2f24685df1e1d4e4897f2d5e98859f2603dcbdb4cb0f97178a31a3c7",
      "component": "future/qt-qualification",
      "path": "config/generated/components/future/qt-qualification.json",
      "scope": "future"
    },
    {
      "canonical_sha256": "afa5c2c6d2eee0fd6de55cf85eedd5063c9463227c37ec292aeb38a47d861319",
      "component": "future/qt-runtime-qualification",
      "path": "config/generated/components/future/qt-runtime-qualification.json",
      "scope": "future"
    },
    {
      "canonical_sha256": "ca2efac648bb12795b3e8e047fed58203397d9109fefcb69096646ec93683325",
      "component": "host-tools/cmake",
      "path": "config/generated/components/host-tools/cmake.json",
      "scope": "build"
    },
    {
      "canonical_sha256": "d083d530430bac2b26d229f11083450f68405c9aa0c3b84a867983bd82b5b640",
      "component": "host-tools/ninja",
      "path": "config/generated/components/host-tools/ninja.json",
      "scope": "build"
    },
    {
      "canonical_sha256": "823262ab7b2f84a6b1b53e5fa525e89e0570b5f2fa89b8644c882225196f0bb4",
      "component": "implementation/candidate-manifest",
      "path": "config/generated/components/implementation/candidate-manifest.json",
      "scope": "supply"
    },
    {
      "canonical_sha256": "c7fe36f8a0e743c8179db499f84ba0bae8d1e11c806ea42e121cacb811d01f60",
      "component": "implementation/cmake-host-tool",
      "path": "config/generated/components/implementation/cmake-host-tool.json",
      "scope": "build"
    },
    {
      "canonical_sha256": "5525192ee2c3054ceb6b5cf5ac4aa29cd32fcc3b251ece7ae84790d5fba17ccd",
      "component": "implementation/complete-sdk-qualification",
      "path": "config/generated/components/implementation/complete-sdk-qualification.json",
      "scope": "qualification"
    },
    {
      "canonical_sha256": "230f73c5b1555fb694ed77f0637460f76a1f5076adb846af327d65f0d5fc5728",
      "component": "implementation/crosspack",
      "path": "config/generated/components/implementation/crosspack.json",
      "scope": "build"
    },
    {
      "canonical_sha256": "a456bde9e3586d9591e404224c33e82a6e6db2d3a98ea65debbb497735f6f812",
      "component": "implementation/crosspack-qualification",
      "path": "config/generated/components/implementation/crosspack-qualification.json",
      "scope": "qualification"
    },
    {
      "canonical_sha256": "4ebad4d58edea9fc4a3d4d9e2ed1b3b29a64b5c0a5dbde279c68537652b57d29",
      "component": "implementation/launcher",
      "path": "config/generated/components/implementation/launcher.json",
      "scope": "build"
    },
    {
      "canonical_sha256": "732447444d086b975a7ec6a13f463dd7ced4696a37ad7015e12d5e64d8bcd862",
      "component": "implementation/ninja-host-tool",
      "path": "config/generated/components/implementation/ninja-host-tool.json",
      "scope": "build"
    },
    {
      "canonical_sha256": "d877da2f512e4f8c183726a2c572f08e1dab54bd0b93a01b5a5bcfd85f00da47",
      "component": "implementation/python-cp310-build-policy",
      "path": "config/generated/components/implementation/python-cp310-build-policy.json",
      "scope": "build"
    },
    {
      "canonical_sha256": "e56b894afb77f86af59a0c65b78814d5be0f5256d5e14af3edd4d1f94c146865",
      "component": "implementation/python-cp310-qualification-policy",
      "path": "config/generated/components/implementation/python-cp310-qualification-policy.json",
      "scope": "qualification"
    },
    {
      "canonical_sha256": "7d4d34401dab8c74b4d1f87e3704f0f66a4a199d317ef82e5a3e29f340e5f0b1",
      "component": "implementation/python-cp311-build-policy",
      "path": "config/generated/components/implementation/python-cp311-build-policy.json",
      "scope": "build"
    },
    {
      "canonical_sha256": "275e4815224bc36e8e2b73c4ab97ad717ff7e02b64f15a15e3280317277be510",
      "component": "implementation/python-cp311-qualification-policy",
      "path": "config/generated/components/implementation/python-cp311-qualification-policy.json",
      "scope": "qualification"
    },
    {
      "canonical_sha256": "c40ff777eff73d7e6bb3a3bf3f110cbed8e5cc287e3830ebe13b6f02c2fc7f23",
      "component": "implementation/python-cp312-build-policy",
      "path": "config/generated/components/implementation/python-cp312-build-policy.json",
      "scope": "build"
    },
    {
      "canonical_sha256": "ce60185a7bd228615fd67bbf47c638dc9993ad647dbe31cf238490c8f449a72d",
      "component": "implementation/python-cp312-qualification-policy",
      "path": "config/generated/components/implementation/python-cp312-qualification-policy.json",
      "scope": "qualification"
    },
    {
      "canonical_sha256": "5f42fcd5d6d207a68cf958a58673d31023cc54c36275269698db5a72bccda576",
      "component": "implementation/python-cp313-build-policy",
      "path": "config/generated/components/implementation/python-cp313-build-policy.json",
      "scope": "build"
    },
    {
      "canonical_sha256": "fb7f3c56cabe3fd4c657a42b76d5709a29d43cd8abf1b07ed675fec3ce010705",
      "component": "implementation/python-cp313-qualification-policy",
      "path": "config/generated/components/implementation/python-cp313-qualification-policy.json",
      "scope": "qualification"
    },
    {
      "canonical_sha256": "8585593866ed19ab7203b188b6d91b6a4ad0d2257e4e2a502d352f4fd2f59906",
      "component": "implementation/python-cp314-build-policy",
      "path": "config/generated/components/implementation/python-cp314-build-policy.json",
      "scope": "build"
    },
    {
      "canonical_sha256": "78569657cb92355bc8bc7dbb32ca2aa4f6c2758996f82c5142d3ef1c8a2110a9",
      "component": "implementation/python-cp314-qualification-policy",
      "path": "config/generated/components/implementation/python-cp314-qualification-policy.json",
      "scope": "qualification"
    },
    {
      "canonical_sha256": "216db081cccb52ca235d449352f29d09383bc901963621a16fdb8cab18c94755",
      "component": "implementation/python-cp39-build-policy",
      "path": "config/generated/components/implementation/python-cp39-build-policy.json",
      "scope": "build"
    },
    {
      "canonical_sha256": "1a71b1d6837f6ff62d5b50aef69200a9ce2aff07417c30cebd050df74a5afaa0",
      "component": "implementation/python-cp39-qualification-policy",
      "path": "config/generated/components/implementation/python-cp39-qualification-policy.json",
      "scope": "qualification"
    },
    {
      "canonical_sha256": "e622706f8e28a435c276a7c2e582e3ca9fda578c101d7a7ca7f7c4f09df3e7b5",
      "component": "implementation/python-qualification-policy",
      "path": "config/generated/components/implementation/python-qualification-policy.json",
      "scope": "qualification"
    },
    {
      "canonical_sha256": "822fe461d134b6f2c5841d9658763d4880640111019da485dd4b9c9beecb1961",
      "component": "implementation/vcpkg-contract-qualification",
      "path": "config/generated/components/implementation/vcpkg-contract-qualification.json",
      "scope": "qualification"
    },
    {
      "canonical_sha256": "9e79c71089e00c2fac15d4e8ecedd47b3405fe0d240baa9d964ab2aeffb5e411",
      "component": "implementation/vcpkg-integration",
      "path": "config/generated/components/implementation/vcpkg-integration.json",
      "scope": "build"
    },
    {
      "canonical_sha256": "507e2e46735c7c5427bf35b699798f2106a4529c3d3133d062e57d0925d0e9b9",
      "component": "implementation/vcpkg-upstream-tier1-qualification",
      "path": "config/generated/components/implementation/vcpkg-upstream-tier1-qualification.json",
      "scope": "qualification"
    },
    {
      "canonical_sha256": "c59274ff500531dcda1e40f83bb2692743fcce69adc646fee100bc00e1bbc01f",
      "component": "implementation/vcpkg-upstream-tier2-qualification",
      "path": "config/generated/components/implementation/vcpkg-upstream-tier2-qualification.json",
      "scope": "qualification"
    },
    {
      "canonical_sha256": "0a93b3ea8179e2b596e0e4eb5d55e0810269f8ac47c2b7322b6fe6451c8e7344",
      "component": "implementation/vcpkg-upstream-tier3-qualification",
      "path": "config/generated/components/implementation/vcpkg-upstream-tier3-qualification.json",
      "scope": "qualification"
    },
    {
      "canonical_sha256": "be14b05aebc58eeb91642e1f3fb019cba033e4801fe489c727e88c7b6bfa1a93",
      "component": "implementation/zstd-build-policy",
      "path": "config/generated/components/implementation/zstd-build-policy.json",
      "scope": "build"
    },
    {
      "canonical_sha256": "69086045f461ec5e2aca006731d120083c6f329540c9b026de116890010573a2",
      "component": "packaging/qualification",
      "path": "config/generated/components/packaging/qualification.json",
      "scope": "qualification"
    },
    {
      "canonical_sha256": "7c6a6d882438c99d4a2efa911a3318656648810489d0f7200f3cc1a27a1a6331",
      "component": "packaging/sdk-build",
      "path": "config/generated/components/packaging/sdk-build.json",
      "scope": "build"
    },
    {
      "canonical_sha256": "0187896b566f3b5141dc2a2528ad896a188c9f55f4c4d05dec28068633105e0a",
      "component": "product/identity",